block,job_size,canonical_name,frequency,business_segments,job_segments,sources_count,so_that,context_when,fitbase_value,barriers,drivers,previous_solution_problems,lpr_quote,sources,all_variants,cluster_id,concept_tag
Клиенты и удержание,Small,Вести учет продаж и посещений в карточке клиента,1,S1,J3,1,Иметь полную историю клиента для анализа и работы с ним.,Клиент покупает абонемент или посещает занятие.,Карточка клиента в CRM.,,Централизация данных.,Нет централизованного учета.,—,Ярослава — открытие студии пилатеса,Вести учет продаж и посещений в карточке клиента,Кли-14,
Клиенты и удержание,Small,Переносить базу клиентов из предыдущей CRM в новую систему,1,S1,J1,1,Быстрый старт работы с новой CRM без потери данных,"Есть существующая база клиентов, не хочется вводить вручную","Помощь в переносе, тестовый перенос, доработка по обратной связи","Неуверенность в качестве переноса, необходимость участия внедренцев","Помощь внедренцев, тестовые переносы, поддержка","В 1С Фитнес и других системах перенос был сложным, не всегда корректным","""Перенос мы помогаем делать... Есть тестовый перенос, смотрите, насколько корректно все перенеслось.""",Оксана — две детских студии (AppEvent),Переносить базу клиентов из предыдущей CRM в новую систему,Кли-15,
Клиенты и удержание,Small,Переносить данные из Excel в CRM без потерь и с минимальными усилиями,1,S1,J1,1,,"Когда начинаю работать с CRM, хочу быстро и без ошибок перенести базу клиентов из Excel","Бесплатный перенос базы при годовом тарифе, консультации специалистов",Возможна очередь на перенос из-за сезона,"Помощь специалистов, тестовый перенос, консультации","Ручной ввод данных занимает много времени, возможны ошибки","""У нас смотрен при подключении от 12 месяцев бесплатный перенос вашей базы с Excel."" ""К этому нужно быть готовым, потому что, ну, система это тоже там все...""",Lime Fitness — хореография,Переносить данные из Excel в CRM без потерь и с минимальными усилиями,Кли-16,
Клиенты и удержание,Small,"Хранить документы клиентов (справки, заявления)",1,S1,J1,1,Чтобы не плодить бумажные документы и иметь быстрый доступ,Когда клиент приносит документы,Возможность прикреплять документы к карточке клиента,"""Мы можем хранить заявление, справку от врача, свидетельство о рождении.""",Загрузка фото документов в карточку клиента,"Бумажные документы, потеря информации",,Танцевальная студия — Mobi-конкурент,"Хранить документы клиентов (справки, заявления)",Кли-17,
Клиенты и удержание,Small,Отслеживать отсутствие справок у клиентов,1,S1,J1,1,Чтобы быстро напомнить и получить недостающие документы,"Когда нужно проверить, кто принес справку, а кто нет",Использование хэштегов и фильтров,"""Можно хэштег настроить 'нет справки' и отфильтроваться.""",Настройка тегов и фильтров,"Нет автоматизации, ручной поиск",,Танцевальная студия — Mobi-конкурент,Отслеживать отсутствие справок у клиентов,Кли-18,
Клиенты и удержание,Middle,Создать комфортное физическое пространство с превосходным качеством отделки и оборудования,1,S5,J3,1,Чтобы сохранить клиентов в сегменте лоу-кост/средний при качестве премиум-клуба,"Когда строил клуб, понимал что в Екатеринбурге насыщенный рынок и клиенты выбирают качество — некомфортно = посмотрят в сторону конкурентов",Хастинг (партнёр) даёт 3D-визуализацию для расстановки тренажёров; Fitbase для управления,,"Хастингс упаковал оборудование под формат, GPT помогал в строительных расчётах",Сложно правильно рассчитать всё с нуля — пришлось менять подрядчика,"«Я в фитнесе давно, клиенты выбирают качество. Если сделаем некомфортное пространство, посмотрят в сторону конкурентов.» (8:49) | «Получилось 10.5 под ключ.» (16:00)","Алексей Кочкин — зал без персонала (Екатеринбург, открытие)",Создать комфортное физическое пространство с превосходным качеством отделки и оборудования,Кли-19,
Клиенты и удержание,Small,Обработка возвратов,1,S5,J1,1,Клиенты были довольны и не уходили недовольными,Когда клиенты хотят вернуть деньги за абонемент,Улучшение информирования клиентов о подписках,Недостаток информации для клиентов,Прозрачность условий,Некоторые клиенты не понимают условия подписки,Я делаю возврат и все.,Speaker A — зал без персонала,Обработка возвратов,Кли-20,
Клиенты и удержание,Small,Поддержка клиентов,1,S5,J1,1,Устранить задержки и недовольство,Когда клиенты сталкиваются с проблемами доступа,Автоматизация поддержки через чат-бота,Ограниченное время для реакции,Наличие связи через Telegram,Клиенты иногда не могут войти в зал,"Я всегда на связи, Телеграм, Макс.",Speaker A — зал без персонала,Поддержка клиентов,Кли-21,
Клиенты и удержание,Middle,Настраивать правила отмены занятий,1,,,1,Чтобы не терять деньги и снижать конфликты,Когда клиенты отменяют в последний момент,Настройка политики отмен,Сложность настройки,Баланс интересов,Нет автоматизации,,АГРЕГИРОВАНО (без привязки к конкретному интервью),Настраивать правила отмены занятий,Кли-22,
Клиенты и удержание,Small,Проверять оплату и возвраты,1,,,1,Чтобы финансы были прозрачны,Когда клиент оплатил/вернул,"Учёт оплат, интеграция кассы",Интеграции с кассой,Автоматизация,"Excel, кассовые ошибки",,АГРЕГИРОВАНО (без привязки к конкретному интервью),Проверять оплату и возвраты,Кли-23,
Клиенты и удержание,Small,Фильтровать клиентов для рассылок,1,,,1,Чтобы персонализировать коммуникации,Когда нужна сегментация,Фильтры в CRM,Нет,Точность маркетинга,"Excel, ручной поиск",,АГРЕГИРОВАНО (без привязки к конкретному интервью),Фильтровать клиентов для рассылок,Кли-24,
Клиенты и удержание,Small,Связать аккаунты родителя и ребенка (общий счет),1,S1,J2,1,,,,,,,,"Каталина Алексеева — пилатес/реабилитация, Гатчина",Связать аккаунты родителя и ребенка (общий счет),Кли-25,
Клиенты и удержание,Middle,Понять реальный риск переноса базы,1,S1,J1,1,,большая клиентская база из 1С под франшизой,,,"Fitbase переносит сам из 1С за 2-3 недели, бесплатно, выборочная проверка по клиентам",,,Анастасия (Пермь) — выход из франшизы (1С+Mobi),Понять реальный риск переноса базы,Кли-26,
Клиенты и удержание,Middle,Связь ребёнок↔родители без потери единого диалога,1,S1,J5,1,,"30% клиентов с 2 номерами родителей; родители разные, оплачивает один, ходит другой",,,,,,Детская студия — дзюдо/тхэквондо (1С),Связь ребёнок↔родители без потери единого диалога,Кли-27,
Клиенты и удержание,Middle,"Тарификация по действующим клиентам, а не по всей базе",1,S2,J2,1,,"у Марины **тысячи клиентов в базе** за все годы работы. «Если за весь период, там, я не знаю, даже там тысячи, две, наверное, три уже надо»",,,,,,Марина — самописная 1С,"Тарификация по действующим клиентам, а не по всей базе",Кли-28,
Клиенты и удержание,Small,Корпоративные карты для семей — есть,1,S2,J2,1,,,,,,,,Марина — самописная 1С,Корпоративные карты для семей — есть,Кли-29,
Расписание и запись,Middle,Отмечать посещения клиентов (QR/чекин/ручная),2,S1,J3,2,"Упростить работу, избежать потерь клиентов, повысить оперативность.","В студии нет администратора, тренеры должны вести часть работы с клиентами.",Мобильное приложение для тренеров.,Нужно оборудование,"Самостоятельность тренеров, снижение нагрузки.","Нет системы, все делается вручную.",—,АГРЕГИРОВАНО (без привязки к конкретному интервью); Ярослава — открытие студии пилатеса,Контролировать посещаемость и списания | Обеспечить возможность тренерам самостоятельно отмечать посещения и записывать клиентов,Рас-01,посещения_отметки
Расписание и запись,Big,Управлять и контролировать администраторов на ресепшене,2,S2,J2,1,"Чтобы упростить работу администраторов, тренеров и управляющих, повысить дисциплину клиентов, улучшить аналитику и коммуникацию с клиентами","Когда управляющий фитнес-клубом с ~150 активными клиентами, где есть групповые, персональные и свободные посещения, и текущая система учёта устарела и не покрывает нужды","Упрощение работы, автоматизация процессов, удобство для клиентов и тренеров, интеграция с мессенджерами, отчётность","Необходимость согласования с собственником, лояльность к текущему ручному процессу, часть клиентов (пенсионеры) не дружат с технологиями","Облачная система, мобильные приложения под бренд, интеграция с мессенджерами, автоматизация записи и оплаты, отчёты, push-уведомления","1С устарела, ""простецкая"", ""миллион раз в лет ее никто не обновлял"", нет автоматизации записи и коммуникаций, ручной ввод данных, отсутствие мобильного приложения","""У нас есть в ручном режиме показывают все это дело в тетрадочку... либо звонят, если не знают, как записываются"" (Василий) || ""У нас только один S-фитнес есть... простые базовые функции... уже миллион раз в лет ее никто не обновлял"" (Василий)",Клуб — общий switch-кейс,Автоматизировать управление фитнес-клубом | Обеспечить удобную запись клиентов на занятия,Рас-02,адмы
Расписание и запись,Middle,Управлять персональными тренировками и записью,1,S1,J1,1,,"Когда тренеры и клиенты хотят записываться на персоналки, нужно организовать удобный и прозрачный процесс записи","Возможность тренера самостоятельно вести записи и график, клиенты могут сами выбирать время",Нет,"Открытая запись для клиентов, возможность скрыть или показать запись на персоналки","Ранее не было прозрачности, ""чтобы не было такого, что он меня не записывает, а того он записывает""","""Ну, мне бы наоборот хотелось, чтобы это было в открытую, знаете, чтобы не было такого, что он меня не записывает, а того он записывает.""",Lime Fitness — хореография,Управлять расписанием и записями на персональные занятия через приложение,Рас-03,персональные_занят
Расписание и запись,Middle,Считать зарплату тренеров без Excel и ошибок,1,S1,J1,1,Чтобы контролировать посещаемость и начислять зарплату тренерам,"Когда у меня есть группы с фиксированным расписанием на год, и нужно отмечать посещения","Возможность создавать расписание на год, отмечать посещения, списывать занятия","Необходимость обучения, настройка системы под особенности ансамбля","Повторяющаяся запись, интеграция с оплатами и зарплатой тренеров","Ручной учет посещений, отсутствие автоматизации","""У нас не личные уроки, а ансамбль... они все 20 человек так и будут ходить весь год целым классом.""",Танцевальная студия — Mobi-конкурент,Управлять расписанием групп и посещениями,Рас-04,зарплата_тренеров
Расписание и запись,Small,Гибко составлять расписание занятий,1,,,1,Чтобы не тратить время еженедельно,Когда нужно планировать на месяцы,Копирование расписаний,Нет,Удобство,Google-календарь — ручное,,АГРЕГИРОВАНО (без привязки к конкретному интервью),Копировать расписание на долгий срок,Рас-05,расписание_создание
Расписание и запись,Middle,Контролировать выручку и продажи в реальном времени,1,S6,J4,1,"клиенты и тренеры записывались быстро и без ошибок, я видел загрузку и выручку","клиенты хотят бронировать корты и тренировки, тренеры должны видеть расписание и клиентов","виджеты для сайта и соцсетей, мобильное приложение с гибкой настройкой интерфейса",нужно обучить тренеров и админов,,,"Когда я как клиент открываю в приложении тренера и записаться на персональную тренировку — я вижу именно те слоты, которые этот тренер сам проставил в своём расписании",Денис — падл-клуб (старт),Организовать и вести учёт бронирования кортов и тренировок,Рас-06,выручка_контроль
Расписание и запись,Small,Делать массовые рассылки и автоматические уведомления клиентам,1,S1,J5,1,,,,,,,,Детская студия — дзюдо/тхэквондо (1С),Лист ожидания с массовой рассылкой о свободных местах — заинтересовал,Рас-07,рассылки_коммуникац
Расписание и запись,Small,Контролировать качество тренировок через просмотр записей и обратную связь,1,S4,J4,1,Чтобы поддерживать высокий уровень тренерской работы,Когда тренеры проводят занятия,"Качество тренировок, безопасность клиентов",,,"Большой объём работы, необходимость систематизации",,"Стас — Stretch House (франшиза, 65 студий)",Контролировать качество тренировок через просмотр записей и обратную связь,Рас-08,
Расписание и запись,Small,Вести расписание с учетом вместимости и листа ожидания,1,S1,J3,1,"Не допускать переполнения, не терять клиентов, автоматизировать процесс.","Есть ограниченное количество реформеров, нужно контролировать количество записанных.",Расписание с ограничением и листом ожидания.,,Автоматизация записи.,Нет автоматического контроля загрузки.,"«Мне нравится вариант, что сайта прям сразу можно посмотреть и оплатить, и не скачивая приложение»",Ярослава — открытие студии пилатеса,Вести расписание с учетом вместимости и листа ожидания,Рас-09,
Расписание и запись,Small,"Управлять расписанием занятий и залами, включая повторяющиеся занятия",1,S1,J1,1,Обеспечить удобное планирование и управление расписанием,"В студии 2-3 зала, занятия повторяются по расписанию, нужно гибко управлять расписанием","Удобный график, возможность повторения занятий, распределение по залам",Возможные сложности с интерфейсом и обучением,"Гибкий график, повторение занятий, распределение по залам","В 1С Фитнес было сложно управлять расписанием, особенно с изменениями","""Можно повторять тренировку, выбирать дни, менять залы.""",Оксана — две детских студии (AppEvent),"Управлять расписанием занятий и залами, включая повторяющиеся занятия",Рас-10,
Расписание и запись,Middle,Управление клиентским потоком,1,S5,J1,1,Избежать перегрузки и обеспечить комфорт,"В часы пик, когда много клиентов",Введение обязательного бронирования в часы пик,Некоторые клиенты не бронируют время,Рекомендации по бронированию,Бывают дни с большим количеством клиентов,Я прошу клиентов бронировать время для посещения зала.,Speaker A — зал без персонала,Управление клиентским потоком,Рас-11,
Расписание и запись,Small,Управлять пиковыми нагрузками и бронированием времени посещения,1,S5,J1,1,Чтобы обеспечить комфорт и безопасность посещения,Когда в часы пик много клиентов и нужно избежать перегрузки зала,"Возможность бронирования слотов, ограничение количества посетителей","Текущая интеграция не работает, данные некорректны",Возможность настройки обязательного бронирования на часы пик,Отсутствие интеграции между CRM и системой контроля мешает точному учету,"«У меня есть рекомендательное правило, 7 слотов, чтобы не больше 7 человек занималось.» (15:14)","Speaker A — зал без персонала (расширенный, 8 джобов)",Управлять пиковыми нагрузками и бронированием времени посещения,Рас-12,
Расписание и запись,Middle,Управлять расписанием занятий (групповые и индивидуальные),1,,,1,Чтобы загрузка тренеров была оптимальной и клиенты довольны,"Когда тренеры ведут параллельно группы, а клиенты часто путаются",Расписание с копированием и листом ожидания,Инд. записи сложнее автоматизировать,"Удобство, автоматизация","Google-календари, ручные записи",,АГРЕГИРОВАНО (без привязки к конкретному интервью),Управлять расписанием занятий (групповые и индивидуальные),Рас-13,
