block,job_size,canonical_name,frequency,business_segments,job_segments,sources_count,so_that,context_when,fitbase_value,barriers,drivers,previous_solution_problems,lpr_quote,sources,all_variants,cluster_id,concept_tag
Расписание и запись,Big,Управлять бизнесом падл-клуба с эффективной системой бронирования и учёта,1,S6,J4,1,"бизнес работал без хаоса, с прозрачной статистикой, удобством для клиентов и тренеров, и я мог принимать управленческие решения","запуск падл-клуба, опыт работы в теннисе, хочет развивать детские/групповые тренировки, турниры, персоналки","мощная CRM + учётная система с интеграциями, мобильными приложениями, автоматизацией и аналитикой","возможные сложности с интеграцией с Мегафоном, необходимость обучения персонала",,,"Я теннисист. Я 10 лет проработал директором спортивной школы теннисной, поэтому я в теннисе",Денис — падл-клуб (старт),Управлять бизнесом падл-клуба с эффективной системой бронирования и учёта,Рас-14,
Расписание и запись,Small,"Онлайн-трансляции занятий через Zoom — заинтересовал, спросил",1,S1,J5,1,,,,,,,,Детская студия — дзюдо/тхэквондо (1С),"Онлайн-трансляции занятий через Zoom — заинтересовал, спросил",Рас-15,
Расписание и запись,Small,Записи в массажной комнате — оформить как групповое занятие на 1 человека,1,S5,J1,1,,,,,,,,Анастасия (Завьялово) — микро-студия без админов,Записи в массажной комнате — оформить как групповое занятие на 1 человека,Рас-16,
Коммуникации и маркетинг,Middle,SMM и контент-маркетинг,3,S1,J1,3,Чтобы не разрываться между разными мессенджерами и соцсетями,"Когда общаюсь с клиентами через разные каналы (WhatsApp, ВКонтакте, Instagram), хочу не терять заявки и вести переписку удобно","Интеграция с WhatsApp, ВКонтакте, Instagram через партнера ""Интеллект Диалог"", возможность вести переписку без VPN","Ограничения Instagram по таргетингу, нестабильность интеграции","Возможность вести переписку из одного окна, автоматизация обработки заявок","Ранее заявки из Instagram приходят без номеров, таргетинг нестабилен, приходится вручную выяснять контакты","""Инстаграм подключается туда, нет?"" ""Да, Инстаграм подключается с помощью нашего партнера Интеллект Диалог."" || ""То есть неважно, откуда клиент пишет и звонит, он к нам приходит сюда.""",Lime Fitness — хореография; АГРЕГИРОВАНО (без привязки к конкретному интервью); Танцевальная студия — Mobi-конкурент,"Вести коммуникацию с клиентами из одного окна, включая мессенджеры и соцсети | Вести коммуникацию с клиентами из разных каналов в одном окне | Интегрировать каналы коммуникации (звонки, WhatsApp, соцсети)",Ком-04,smm_контент
Коммуникации и маркетинг,Middle,"Управлять акциями, скидками и промокодами",2,"S1, S5",J3,2,"Повысить скорость реакции, не терять клиентов, контролировать коммуникацию и качество обслуживания.","Клиенты пишут в Instagram, WhatsApp, Telegram, ВК, нужно быстро и удобно отвечать.",Чат с интеграцией мессенджеров.,Сезонность (нужна тёплая погода для летнего бодиара),Знакомый блогер-актер согласился участвовать,"Нет единого окна коммуникации, заявки могут теряться.","«Хотим раздачу флаеров с промокодами промоутером, но не грустного мальчика, а веселого качка. В костюме Спайдермена, потом Хитмана.» (25:41) || —","Алексей Кочкин — зал без персонала (Екатеринбург, открытие); Ярослава — открытие студии пилатеса",Использовать промоутера-блогера в костюме для раздачи флаеров с промокодами | Обеспечить удобную коммуникацию с клиентами через разные каналы в одном окне,Ком-01,акции_скидки
Коммуникации и маркетинг,Small,Интегрировать все мессенджеры в одно окно (WhatsApp/TG/Max/VK/Instagram),2,"S1, S2","J2, J5",2,"Чтобы не терять историю общения, быстро реагировать на запросы и передавать информацию новым сотрудникам","«WhatsApp фактически не работает. Telegram работал корректно, там надо все это через бота, и если пишут в бота, то это только в 1С, а на аккаунт Телеграма не подгружается»","Интеграция всех каналов в одном окне, хранение переписок, возможность передачи прав тренерам",Возможные сложности с внедрением и обучением,"Fitbase-чат как зеркало личного Telegram (без бота), WhatsApp через свою интеграцию, MAX в PRO","Отсутствие единой системы, переписки разбросаны по разным мессенджерам","""Все переписки, они все хранятся в системе... если администратор уволился, то мы потом всю информацию по их перепискам можем собрать быстро"" (Мария)",Детская студия — дзюдо/тхэквондо (1С); Клуб — общий switch-кейс,Обеспечить коммуникацию с клиентами через мессенджеры | Получить рабочий канал WhatsApp + Telegram в одной CRM,Ком-03,коммуникация_мессенджеры
Коммуникации и маркетинг,Small,IP-телефония для работы с клиентами,2,S1,J1,2,Чтобы вести корректный учет и не путаться в клиентах,Когда приходит новый клиент из соцсетей или мессенджеров,Автоматическая проверка и создание заявок,Стоимость подключения,Автоматическая проверка по номеру телефона,Ручной поиск и проверка клиентов,"""Программа проверяет на дубль по номеру телефона клиента.""",АГРЕГИРОВАНО (без привязки к конкретному интервью); Танцевальная студия — Mobi-конкурент,Подключать IP-телефонию | Проверять заявки на дубли по номеру телефона,Ком-06,ip_телефония
Коммуникации и маркетинг,Middle,Делать массовые рассылки и автоматические уведомления клиентам,2,S5,J1,2,Чтобы повысить retention и LTV,"«У администраторов даже орфографию не соблюдают, когда общаются с клиентами»","SMS, WhatsApp, push",Лимиты рассылок,40 автоматизаций (стандарт) / без ограничений (PRO) + Fitbase-чат как зеркало WhatsApp/Telegram/ВК/Max,"Ручные рассылки, WhatsApp copy-paste",,АГРЕГИРОВАНО (без привязки к конкретному интервью); Анастасия (Завьялово) — микро-студия без админов,"Автоматизация всей коммуникации (рассылки, напоминания, поздравления) | Удерживать клиентов через коммуникации и рассылки",Ком-08,рассылки_коммуникац
Коммуникации и маркетинг,Middle,Видеть кто «засыпает» и возвращать до отмены (удержание),1,S1,J1,1,"Снизить нагрузку на менеджеров, повысить вовлеченность клиентов и удержание","Нужно было быстро и удобно оповещать клиентов о событиях, акциях, окончании абонементов, но предыдущие решения не давали гибкости","Автоматизация до 40 действий, сегментированные рассылки, интеграция с мессенджерами через Feedbase Chat","Страх блокировки номеров, необходимость правильной настройки рассылок","Автоматизация, сегментация, интеграция с мессенджерами, возможность настройки времени и частоты рассылок","В 1С Фитнес и других системах рассылки были неудобны, медленные, дорогие (WhatsApp), блокировки","""Можно настроить, что сразу практически отправлял 7 сообщений... Можно настроить, чтобы не заблокировали... Можно сегментировать клиентов.""",Оксана — две детских студии (AppEvent),Автоматизировать коммуникации с клиентами через разные каналы,Ком-02,удержание_отток
Коммуникации и маркетинг,Middle,Лидогенерация и воронка продаж (заявки → клиент),1,S1,J1,1,,"Когда веду продажи и обработку заявок, хочу видеть, сколько заявок на каком этапе, причины отказов и конверсию","Автоматизированная воронка с возможностью строить несколько сценариев, отслеживать тайминг обработки заявок",Нет,"Автоматизация, аналитика, интеграция с разными источниками заявок","У конкурентов (Моби Фитнес) воронка менее автоматизирована, нет интеграции с AMSRM","""У них нет, наверное, воронки продаж, это, наверное, основное. Она у них есть, но она не очень автоматизированная.""",Lime Fitness — хореография,Анализировать эффективность продаж и работы с клиентами через воронку продаж,Ком-05,лиды_воронка
Коммуникации и маркетинг,Middle,"Локальный геомаркетинг (ЖК-чаты, штендеры, виндеры)",1,S5,J3,1,Чтобы достичь финмодели в октябре и доказать инвестору жизнеспособность модели,Когда я только открылся (52 подписки + 200 установок приложения за 2 недели) и нужно к октябрю выйти на 270 подписок + 30 разовых = 300 клиентов,CRM ведёт учёт всех каналов привлечения,,"Возможность отслеживать источники, привязка к мобильному приложению",Маркетинга по сути не вели (одно сообщение в чате ЖК),«Маркетинг не нужен. Нужно удачное место. И самый главный маркетинг — это вот чат из ЖК.» (18:50) | «У меня 5000+ квартир в пятиминутной ходьбе.» (4:00),"Алексей Кочкин — зал без персонала (Екатеринбург, открытие)",Привлечь 300 целевых клиентов к октябрю через локальный геомаркетинг,Ком-07,geo_маркетинг
Коммуникации и маркетинг,Middle,Снизить TCO стека и избавиться от доплат за каждую фичу,1,S2,J2,1,,"«У нас это в телефоне сейчас, и вот это выпускаем, бывает моментом» — теряет сообщения",,,"Fitbase-чат, 5 мессенджеров встроены, без доплат",,,Марина — самописная 1С,Все мессенджеры в одном окне без доплат,Ком-09,tco_доплат
Коммуникации и маркетинг,Small,"Избавиться от раздражающих уведомлений и ботов в системе, которые мешают работе",1,S3,J4,1,"Чтобы работать спокойно, не отвлекаться и не тратить время на фильтрацию сообщений","Когда получаю много уведомлений от бота техподдержки, которые мешают видеть реальные сообщения","Улучшение UX, уменьшение количества ненужных уведомлений","""У меня миллиард сообщений от бота, это раздражает"" 1:03:00",Необходимость изменения логики уведомлений и работы бота,"Бот техподдержки постоянно пишет, мешает видеть реальные сообщения, раздражает",,"Дмитрий — сеть, JTBD-вариант","Избавиться от раздражающих уведомлений и ботов в системе, которые мешают работе",Ком-10,
Коммуникации и маркетинг,Small,Управлять коммуникацией с партнёрами и подрядчиками,1,S4,J4,1,Чтобы обеспечить слаженную работу сети,Когда нужно координировать работу и решать вопросы,"Координация, решение проблем",,,"Много коммуникаций, необходимость систематизации",,"Стас — Stretch House (франшиза, 65 студий)",Управлять коммуникацией с партнёрами и подрядчиками,Ком-11,
Коммуникации и маркетинг,Middle,Выбрать правильную локацию для зала без персонала,1,S5,J3,1,Чтобы окна сами рекламировали клуб + был органический трафик в первые недели,"Когда искал помещение под зал, ориентировался на густонаселённые ЖК с большой плотностью населения и небольшим количеством конкурентов рядом",—,,"Уникальное помещение как самореклама (видовые окна, первый этаж, неоновая вывеска через окна)",—,"«Окна, они уже сами рекламируют. К сожалению, у нас не самое проходное место — это уже крайний дом.» (20:24)","Алексей Кочкин — зал без персонала (Екатеринбург, открытие)",Выбрать правильную локацию для зала без персонала,Ком-12,
Коммуникации и маркетинг,Small,Кросс-маркетинг с соседним бизнесом ЖК,1,S5,J3,1,Чтобы охватить местных жителей через привычные им точки,"Когда вокруг много кафе, спа-салонов, парикмахерских, аптек и пунктов выдачи Wildberries",—,Пока не определились с форматом,Готовы партнёры в списке,—,"«У нас уже список по кросс-маркетингу довольно широкий. Хотим сначала весь геомаркетинг использовать, и дальше идти в кросс-маркетинг.» (21:41)","Алексей Кочкин — зал без персонала (Екатеринбург, открытие)",Кросс-маркетинг с соседним бизнесом ЖК,Ком-13,
Аналитика и управление,Small,Стратегическое планирование и целеполагание ЛПР,1,S4,J4,1,Чтобы эффективно достигать результатов,Когда нужно определить приоритеты и задачи на месяц,"Фокус, эффективность",,,Требует времени и концентрации,,"Стас — Stretch House (франшиза, 65 студий)",Проводить стратегическое планирование и целеполагание,Ана-01,стратегия
Аналитика и управление,Small,BI-аналитика и дашборды по бизнесу,1,S2,J2,1,Чтобы быстро получать аналитику и принимать управленческие решения,"Когда отчёты ведутся управляющим вручную, без автоматизации","Более 40 видов отчётов, автоматизация, аналитика","Неинтересно для тренера, больше для управляющего","Автоматизация отчётов, доступ к аналитике в системе","Ручное ведение отчётов, ограниченный доступ к данным","""Управляющие занимаются... финансовые моменты он там смотрит... я думаю, это вам в вашей роли неинтересно"" (Мария)",Клуб — общий switch-кейс,Вести отчётность по посещаемости и продажам,Ана-02,аналитика_бизнеса
Аналитика и управление,Small,Контролировать выручку и продажи в реальном времени,1,S6,J4,1,,,,,,,"«Мы создаём кастомную историю. Вы ему заказываете всё, что хотите, как угодно» (31:07)",Денис — падл-клуб (старт),"Получать управленческие отчёты по загрузке кортов, выручке, тренерам",Ана-03,выручка_контроль
СКУД и доступ,Small,Масштабироваться (открывать новые точки / стать сетью),2,S5,"J1, J3",2,Чтобы снизить затраты и упростить управление доступом,"Когда планирую новый зал и не хочу платить 170 тыс. ₽ за контроллер Сигур, как у конкурентов","Интеграция с домофоном, управление доступом через мобильное приложение","Технические риски нового решения, не везде применимо","Новое решение дешевле (12 тыс. руб.), удобнее, управление через приложение","Сигур дорогой, сложная интеграция, статические QR-коды","«Я планирую запуск еще одного зала, и там я попробую не с Сигуром поработать, а с кем-то другим.» (2:38) || См. аналогичный кейс Speaker A.","Speaker A — зал без персонала (расширенный, 8 джобов); Алексей Кочкин — зал без персонала (Екатеринбург, открытие)",Минимизировать стоимость СКУД при масштабировании | Обеспечить масштабирование бизнеса с новым залом и альтернативными решениями контроля доступа,СКУ-01,масштабирование
СКУД и доступ,Small,Управлять ролями и доступом сотрудников в системе,1,S5,J1,1,Чтобы сохранить имущество и избежать убытков,Когда я управляю залом и хочу минимизировать случаи воровства и несанкционированного прохода,"Интеграция с видеонаблюдением, контроль доступа через Сигур","Нет явных барьеров, система устраивает","Видеонаблюдение, дежурные тренеры, система контроля доступа","Были случаи несанкционированного прохода, но серьезных проблем не было",«Случаев воровства не было ни одного... Контролирую видеонаблюдением и дежурными тренерами.» (9:21),"Speaker A — зал без персонала (расширенный, 8 джобов)",Обеспечить безопасность и контроль доступа в зал,СКУ-02,роли_доступ
СКУД и доступ,Middle,Управлять и контролировать администраторов на ресепшене,1,S5,J1,1,,"Анастасия живёт в городе, а зал в селе. Управляющий «живёт рядышком», но не на постоянке.",,,FitBase Click (планшет) + интеграция с домофоном через китайское оборудование 50-60к,,,Анастасия (Завьялово) — микро-студия без админов,Убрать ресепшен полностью — клиент входит сам через домофон/планшет,СКУ-03,адмы
